"46"|"FOX"|"1",NULL,NULL,"https://www.dafy-moto.com/images/brand/medium/logo_fox-352.jpg"|"1974 voit naître la marque américaine Fox Racing, aujourd’hui emblématique dans le monde du motocross. Fox confectionne, réalise et équipe les pilotes amateurs et professionnels, mais surtout des champions du monde, en commençant par Brad Lackey remportant le premier championnat du monde de Motocross ! Avec plus de 40 victoires au compteur, la marque voit sa renommée grandir. Fox connait les besoins de ses pilotes et les équipe de la tête aux pieds, du casque aux bottes, en passant par le maillot, le pantalon et les gants tout-terrain. C'est cette symbiose du savoir-faire et l’expérience, acquise sur les terrains les plus complexes, qui permettent à Fox Racing de développer et améliorer ses technologies pour vous équiper durant les années futures !"
"47"|"FRANCE ANTIVOL"|"1",NULL,NULL,"https://www.dafy-moto.com/images/brand/medium/france-antivol.png"|"France Antivol existe depuis 1981 et fabrique des antivols pour motos et scooters, tous homologués (classe SRA et certifiés NF/FFMC). Acteur incontournable sur le marché du 2-roues, France Antivol ne cesse d’innover pour concevoir des antivols haute-sécurité qui soient à la fois pratique à transporter et à utiliser. Antivols U, chaînes, bloques disques, antivols articulés, antivols câbles, tous les produits ont été conçus pour garantir une protection optimale de votre 2-roues."
"48"|"FRANCE EQUIPEMENT"|"1",NULL,NULL,"https://www.dafy-moto.com/images/brand/medium/france-equipement.png"|"France Equipement, c’est la référence de l’accessoire moto avec plus de 30 ans d’expérience dans la production de pièces motos, quads et pièces scooters. L’entreprise met en avant le respect de valeurs fortes : le made in France, l’engagement et le sens de la relation clients. Elle est également très présente en compétition pour rester toujours au top de la technologie. L'accessoiriste propose des batteries de moto, des disques de frein et tout le nécessaire pour l'entretien de votre moto : des kits chaine, graisse, pignons, leviers...France Equipement, c'est l'indispensable dans le monde de la moto."
"49"|"FREEGUN"|"1",NULL,NULL,"https://www.dafy-moto.com/images/brand/medium/logofreegun-388.png"|"Découvrez Freegun, la marque des sportifs depuis 2007. Elle est spécialisée dans les  vêtements et accessoires streetwear et de sports extrêmes, toutes disciplines confondues : stunt, mais aussi jet ski, paint ball, etc… Elle sponsorise de nombreux pilotes de haut niveau, ce qui a largement contribué à sa renommée actuelle. Le fabricant français se distingue par le graphisme et le design de ses produits, qui font toujours preuve de beaucoup de créativité, dans un style très coloré et décalé. Pour vous les accros du cross optez pour des coloris originaux pour votre casque tout-terrain. Eblouissez vos adversaires avec un pantalon au design original. Restez libre sur le terrain avec un maillot vous offrant une souplesse maximale et choisissez l’innovation Freegun pour vos gants tout-terrain. Design affirmé, couleurs explosives, protections et passion : restez fun pendant vos compétitions !"
"50"|"GARMIN"|"1",NULL,NULL,"https://www.dafy-moto.com/images/brand/medium/garmin.png"|"A la recherche d'aventure, de nouvelles routes, de nouveaux trajets et de destinations exotiques ? Ou juste un besoin d'arriver avec certitude à votre destination ? Les GPS Garmin peuvent vous aider à trouver votre chemin. Une lisibilité exemplaire, une utilisation simple et rapide, vous ne vous perdrez plus sur la route. Avec un support moto, un cable d'alimentation, vous serez parés pour de nouvelles aventures ! Les GPS Zumo sont disponibles en différentes tailles en fonction de votre moto. Déterminez votre destination et suivez le guide !"
"51"|"GIVI"|"1",NULL,NULL,"https://www.dafy-moto.com/images/brand/medium/givilogo-2-251.jpg"|"Spécialiste italien de la bagagerie moto et scooter, Givi est réputé pour son savoir-faire et la qualité irréprochable de ses produits. Depuis plus de 40 ans, innovation et qualité sont les maitre-mots de Givi. En matière de bagagerie moto, Givi a plus d'un tour dans son sac : sac à dos, sac de selle, sacoche de réservoir, valise et top-case. Avec Givi, soyez sûr de trouver une bagagerie souple ou rigide de qualité pour votre moto ou votre scooter !"
"52"|"GS27"|"1",NULL,NULL,"https://www.dafy-moto.com/images/brand/medium/gs27-253.png"|"GS27 est une marque française, leader sur le marché de l’entretien automobile. Elle propose une ligne de produits dédiés à l’entretien moto. Avec plus de 40 années d’expérience dans le domaine, l’entreprise a su développer des produits de plus en plus innovants et efficaces pour répondre aux besoins des utilisateurs. La gamme, vous permettra de trouver le produit qui vous convient : lustreur, nettoyant, graisse, rénovateur,… tout y est !"
"53"|"GYRON"|"1",NULL,NULL,"https://www.dafy-moto.com/images/brand/medium/logo_gyron.png",
"54"|"HIFLOFILTRO"|"1",NULL,NULL,"https://www.dafy-moto.com/images/brand/medium/hiflofiltro.png"|"Hiflofiltro est une marque premium de filtres à huile et filtres à air pour motos, scooters et quads. Conçus avec des normes de qualité extrêmes, les filtres Hiflofiltro offrent un niveau de protection pour le moteur et des performances imbattables. La marque fournit au client final les filtres de rechange, mais elle fournit également les fabricants d’équipements d’origine, depuis 1955."
"55"|"IMC-CRÉATION"|"1",NULL,NULL,"https://www.dafy-moto.com/images/brand/medium/IMC-Creation.png",
"56"|"JT RACING"|"1",NULL,NULL,"https://www.dafy-moto.com/images/brand/medium/new-jt-logo-285.jpg"|"JT Racing est une marque américaine d'équipement moto cross, née dans les années 1960. Elle a été créée par un couple ayant développé des chaussettes de cross spécifiques. Ils ont peu à peu étendu leur gamme de produits et trouvé des distributeurs. Dans le milieu des années 70, la croissance de JT Racing est fulgurante, comme celle de la discipline ! L’entreprise signe des contrats avec les meilleurs pilotes américains de l’époque, qui deviennent des champions reconnus ! JT Racing livre les plus produits les plus innovant et les plus stylé sur son marché tout en élevenat le niveau de sécurité. Le niveau de personnalisation des maillots JT Racing permettra de vous différencier et de vous rendre unique, tout comme la marque le fait avec ses pilotes. Terminez votre panoplie avec un pantalon tout-terrain de la marque !"
"57"|"K&N"|"1",NULL,NULL,"https://www.dafy-moto.com/images/brand/medium/k-n.png"|"K&N est le spécialiste des filtres à air et filtres à huile pour tous types de véhicules motorisés. Avec une expérience de plus de 30 ans, K&N propose des filtres de qualité supérieure offrant des performances inégalables. K&N est le premier fabricant a avoir inventé le filtre à air en coton réutilisable. C'est aussi le premier fabricant à fabriquer des filtres à air lavables. Proposant des filtres à huile mais aussi des filtres à air, K&N distribue ses produits dans plus de 30 pays dans le monde. Avec plus de 5000 références dans son catalogue, vous trouverez obligatoirement votre le filtre adapté à votre moto."
"58"|"KIT BRAKE"|"1",NULL,NULL,"https://www.dafy-moto.com/images/brand/medium/kit-brake.png",
"59"|"KYOTO"|"1",NULL,NULL,"https://www.dafy-moto.com/images/brand/medium/kyoto_logo-260.png"|"Kyoto est une marque japonaise, spécialiste dans la fabrication d’accessoires moto. Elle propose à la fois du consommable et des pièces techniques. La gamme de produits est très large : bloque fourche, câble de gaz, câble d'embrayage, transmission, freinage, batterie, pièces détachées moto et scooter, vous retrouvez tout le nécessaire pour l’entretien de votre 2-roues. Kyoto propose également des disques de frein ou d'embrayage, des leviers, des filtres à huile et des filtres à air pour votre moto. Sans oublier des sélecteurs forgés et spy de fourche !"
"60"|"ASTONE"|"1",NULL,NULL,"https://www.dafy-moto.com/images/brand/medium/astone-241.png"|"Astone Helmets® est une marque française dédiée aux casques moto. La gamme de casques proposée par la marque est très vaste et permet ainsi de répondre aux besoins de tous, quels que soient vos besoins : casque intégral, casque jet, modulable, femme, enfant, casque cross. Les casques développés par la marque répondent aux normes de sécurité en vigueur et font l’objet de certification en laboratoire. A ce titre, tous les casques Astone rentrent dans la catégorie des Equipements de Protection Individuelle."
"61"|"LUMA"|"1",NULL,NULL,"https://www.dafy-moto.com/images/brand/medium/luma-163.jpg",
"62"|"MAD"|"1",NULL,NULL,"https://www.dafy-moto.com/images/brand/medium/logomad.jpg-337.jpg",
"63"|"MARVING"|"1",NULL,NULL,"https://www.dafy-moto.com/images/brand/medium/marving-164.png",
"64"|"MECACYL"|"1",NULL,NULL,"https://www.dafy-moto.com/images/brand/medium/mecacyl.png",
"65"|"MEIWA"|"1",NULL,NULL,"https://www.dafy-moto.com/images/brand/medium/meiwa.png"|"Meiwa est un fabricant japonais de filtre à huile et de filtre à air moto. Partenair technique LCR HONDA MOTOGP  team, Meiwa développe, à Shizuoka au Japon, des pièces et accessoire de remplacement. La marque a développé sons sytème Multi Stage Filtration afin de garantir une filtration parfaite sans particules ni impurtées de l'huile moteur. Les filtres à huile Meiwa garantissent ainsi une pression d'huile constante et un flux propre de votre huile, nécessaire pour votre moteur. les même attentions sont apportées concernant la fabrication des filtes à air. La protection de votre moteur est garantie avec les filtres à air et filtres à huile Meiwa !"
"66"|"METZELER"|"1",NULL,NULL,"https://www.dafy-moto.com/images/brand/medium/metzeler.png"|"Fondée en 1863, la société Allemande Metzeler est une entreprise de pneumatique historique. À l'origine producteur de caoutchouc et plastique, c'est dès 1892 que la société s'intéresse à la conception de pneus moto. Depuis, Metzeler produit exclusivement des pneus motos depuis 1979. Ce manufacturier profite de son expérience et met au point de nombreuses technologies sur ses pneus actuels comme le Contour Modelling System prévu pour les hautes performances de conduite des motos récentes ou encore le Fine Carbon Matrix destiné à garantir un plus haut niveau d'adhérence. Le fabricant dispose également de la technologie Interact™, permettant d'offrir des performances optimales dans toutes les conditions. Metzeler est aussi leader en enduro avec 22 titres au cours de ces 9 dernières années. Que vous rouliez sur route, sur circuit, ou en tout-terrain, Metzeler est un choix de pneus moto parfaitement compatible avec votre pratique du 2 roues."
"67"|"PNEUS MOTO MICHELIN"|"1",NULL,NULL,"https://www.dafy-moto.com/images/brand/medium/michelin-315.png"|"Créée en 1889 la société Michelin est basée à Clermont-Ferrand. Elle conçoit et fabrique des pneumatiques pour tous types de véhicules. Avec 360 victoires de 1976 à 2008 en Moto GP, 26 titres mondiaux, 14 titres de Champion d'Europe d'Endurance, 13 victoires aux 24 Heures du Mans Moto et 13 victoires au Bol d'Or, Michelin dispose d'un palmarès inégalé et d'un savoir-faire de pointe en matière de pneus moto. Inscrite dans les gènes de l'entreprise, la compétition est pour Michelin un laboratoire technologique au service de l'innovation. L'innovation est le moteur de Michelin qui propose depuis toujours des pneus moto dont l'équilibre des performances est sans compromis : niveau de grip, constance et polyvalence se retrouvent dans les solutions mises en œuvre. Les compétences et le savoir-faire du manufacturier se retrouve sur tous les terrains, la piste mais aussi sur la route et en ville !"
"68"|"MONSTER ENERGY"|"1",NULL,NULL,"https://www.dafy-moto.com/images/brand/medium/monster-energy-logo-on-white-308.png"|"Monster Energy est à la base une boisson énergisante lancée en 2002, reconnaissable par son logo représentant une triple griffure verte qui rappelle la lettre M. Monster Energy investit très peu en publicité mais mise tout sur le sponsoring de sports extrêmes pour se faire connaître, dont la moto, et le bmx. Forte de cette présence dans le sport, la marque développe et fabrique désormais des vêtements et accessoires sportswear (t-shirt, casquette, bonnet,…)."
"69"|"MOTUL"|"1",NULL,NULL,"https://www.dafy-moto.com/images/brand/medium/motul.png"|"Motul, c’est 150 ans d’histoire ! L’entreprise est française et spécialiste dans la conception, l’élaboration et la distribution de lubrifiants pour moteurs. Huiles moteur Motul, graisses, liquide de frein, liquide de refroidissement, tout est là pour l’entretien complet de votre moto. Motul pousse toujours plus loin les innovations en matière de lubrifiant. En proposant des huiles moteur semi-synthèse puis 100% synthèse par la suite, Motul s'offre une place de choix dans le secteur de la mécanique. Motul propose un gamme d'huile moteur pour moto depuis plus de 80 ans ! L'expértise de la marque n'est plus à démonter pour le choix de votre huile et lubrifiant."
"70"|"MUC OFF"|"1",NULL,NULL,"https://www.dafy-moto.com/images/brand/medium/muc-off.png",
"71"|"NGK"|"1",NULL,NULL,"https://www.dafy-moto.com/images/brand/medium/ngk.png"|"NGK est un grand groupe international naît au Japon qui commercialise entre autres des bougies d’allumage et de préchauffe pour les constructeurs automobiles (équipement d’origine) et alimente le marché de la rechange pour l’auto, les cyclomoteurs, les motos et d’autres secteurs de l’industrie. NGK s'attache a fournir des produits de qualité, répondant aux nouvelles exigences économique et écologique. L'exigence et l'expertise de NGK dans son domaine sont mondialement reconnues. Son savoir faire est devenu une référence auprès des  constructeurs, distributeurs et dans réparateurs dans l'univers de l'automobile comme de la moto."
"72"|"NO FEAR"|"1",NULL,NULL,"https://www.dafy-moto.com/images/brand/medium/no-fear.png",
"73"|"NOLAN"|"1",NULL,NULL,"https://www.dafy-moto.com/images/brand/medium/nolan.png"|"Nolan est un fabricant italien de casques pour motos et scooters. Les marques Nolan®, X-lite®, Grex® et N-Com® sont les quatre piliers du Groupe Nolan. Le Groupe Nolan est synonyme de technologie, de sécurité et de design. Un laboratoire interne et certifié permet de garantir la sécurité et la qualité des produits."
"74"|"OVERLAP"|"1",NULL,NULL,"https://www.dafy-moto.com/images/brand/medium/overlap.png"|"Overlap est une marque du groupe RiderValley, spécialisée dans la conception et le développement de vêtements et chaussures de moto. Précurseur avec les pantalons et jeans de moto, la gamme s’est enrichie avec des vestes moto cuir et des chaussures cuir typées urbaines et vintages pour la moto. La marque complète son offre avec des gants de moto. Overlap allie style et sécurité pour répondre aux utilisateurs des 2 roues, masculins et féminins. C'est une marque qui rappelle toute cette ambiance, cette odeur d'huile, d'essence et de mécanique aussi authentiques que la collection proposée par le fabricant."
"75"|"OXFORD"|"1",NULL,NULL,"https://www.dafy-moto.com/images/brand/medium/oxford-303.png"|"Faites confiance à Oxford pour vos accessoires et équipement moto. Depuis 1973, la marque anglaise fabrique et développe des accessoires moto afin de vous rendre la conduite à deux-roues plus agréable. Oxford vous propose une large gamme de produits allant du bloque disque au tour de cou, en passant par le sac à casque. Reconnus pour leur conception innovante, avec l’impression 3D et la recherche de la meilleure expérience à moto. Laissez-vous séduire par la qualité anglaise distribuée dans plus de 60 pays et possédant une filiale en Amérique du Nord. Roulez libre et sans encombre avec des produits de qualité."
"76"|"PINLOCK"|"1",NULL,NULL,"https://www.dafy-moto.com/images/brand/medium/logo_pinlock.png"|"Le Pinlock est un invention majeure de ces dernières dans le monde de la moto. Le problème de buée et de condensation à l'intérieur du casque moto, qui a vu passer toutes les expériences et méthodes les plus extrèmes, trouve avec un écran Pinlock, la fin de son existence. Un écran Pinlock améliore la visibilité des conducteurs de moto. Simple à mettre en place, son emplacement est aujourd'hui prévu par tous les fabricants de casque qui y ajoutent aujourd'hui leur propre version d'origine. Vérifiez toujours la compatbilité de votre casque avec un écran Pinlock car il existe autant de versions que de modèles de casques. L'installation de ce film anti-buée se réalise en quelques minutes et est à la portée de tous !"
"77"|"PIRELLI"|"1",NULL,NULL,"https://www.dafy-moto.com/images/brand/medium/pirelli.png"|"Pirelli utilise toute son expertise en provenance de la compétition, comme au sein du WSBK ou du Championnat du Monde Motocross, pour développer des pneus moto pour les pilotes qui veulent gagner et repousser leurs limites en toutes situations. L'activité compétition et pneus pistes a toujours été le laboratoire principal afin de développer au quotidien les pneus moto Pirelli les plus performants, qui ne sont pas des prototypes, mais des pneus moto disponibles pour tous les motards sur les différents marchés. Pirelli propose également toutes une sélection de pneus pour toutes les utilisations : Que vous rouliez sur route, en trail, en custom, de façon sportive ou en scooter en ville il existe toujours des pneus pour votre 2...ou 3 roues !"
"78"|"PRINT"|"1",NULL,NULL,"https://www.dafy-moto.com/images/brand/medium/print-252.png"|"Print propose toute une gamme de protège réservoir et d'autocollant pour votre moto permettant de lui épargner toutes les éraflures. Que vous souhaitiez lui épargner ce traitement ou pour simplement la personnaliser, les produits de la gamme Print sont universels et s'appliqueront sur tous les modèles de moto. Faciles à mettre en place, pourquoi s'en passer ? Print assure également votre sécurité avec des réflecteurs de casque. Ils permettront également de personnaliser votre casque tout en vous assurant d'être parfaitement visible en toute circonstance !"
"79"|"PROGRIP"|"1",NULL,NULL,"https://www.dafy-moto.com/images/brand/medium/progrip.png"|"Les produits de la marque Progrip sont fabriqués par une entreprise italienne du nom de Plastiche Cassano, qui bénéficie d’une expérience forte de ses plus de 60 années d’existence. Elle s’est fait son nom tout d’abord grâce à sa production de poignées de guidon moto fabriquées en corne de buffle, puis après guerre, en plastique. Après avoir été un fabricant de bouton en plastique, Plastiche Cassano, par l'intermédiaire de Progrip, a décliné son savoir faire pour la conception et fabrication de masque de motocross et trial. Le contrôle qualité est aussi une étape importante dans la fabrication des produits de la marque garantissant ainsi un haut niveau de fabrication pour un prix très attractif."
"80"|"REGINA"|"1",NULL,NULL,"https://www.dafy-moto.com/images/brand/medium/reegina.png",
"81"|"REV'IT"|"1",NULL,NULL,"https://www.dafy-moto.com/images/brand/medium/revit.png"|"Fondée en 1995 aux Pays-Bas, la marque REV'IT s'est rapidement distinguée pour ses équipements de moto. REV'IT possède une large gamme de vêtements moto pour homme et femme : blousons et vestes en textile et cuir, pantalons, chaussures et bottes de moto. Alliant qualité et confort, les équipements REV'IT convaincront tous les motards passionnés ! Avec sa gamme route et trail, REV'IT a progressivement développé son offre, notamment avec des combinaisons en cuir de haute qualité. Sans oublier les matériaux exceptionnels pour assurer une sécurité optimale ainsi que des homologations et certifications, gages de fiabilité."
"82"|"RICHA"|"1",NULL,NULL,"https://www.dafy-moto.com/images/brand/medium/richa.png",
"83"|"RIO"|"1",NULL,NULL,"https://www.dafy-moto.com/images/brand/medium/rio.png"|"Avec son équipe de Recherche & Développement toujours à l’affût de créations pour combler de bonheur les yeux, le besoin de confort et de technologie, et le portefeuille des motards connus, reconnus et écoutés depuis 1974, le groupe Dafy lance aujourd’hui la marque de casques moto Rio.Que vous rouliez en 50cc ou en Maxi Scoot, et quel que soit votre style de conduite, vous trouverez forcément casque dans la gamme Rio qui propose un casque jet, un intégral et un casque modulable."
"84"|"S-LINE"|"1",NULL,NULL,"https://www.dafy-moto.com/images/brand/medium/sline-166.jpg",
"85"|"SAPHIR"|"1",NULL,NULL,"https://www.dafy-moto.com/images/brand/medium/saphir.png",
"86"|"SBS"|"1",NULL,NULL,"https://www.dafy-moto.com/images/brand/medium/sbs_log-269.png"|"Les produits SBS offre un très haut niveau de qualité, tant pour la pratique de la moto en loisir, que pour une pratique de compétition de haut niveau. SBS propose la gamme de produits la plus complète du marché, avec des plaquettes de frein pour toutes les pratiques : route, tout-terrain, piste et scooter."
"87"|"SCHUBERTH"|"1",NULL,NULL,"https://www.dafy-moto.com/images/brand/medium/schuberth_logo-293.png"|"Schuberth fabrique des casques de moto depuis 1954. La marque allemande propose une large sélection de casques, du jet au modulable en passant par le casque intégral. La fiabilité est le point fort de Schuberth, à l'image du C3 Pro, casque modulable le plus réputé de la marque. Les casques Schuberth se positionnent sur un segment haut de gamme du deux roues : ils sont fabriqués à partir de matériaux de haute qualité. Les casques moto Schuberth n'ont qu'une vocation ! Conquérir le monde et être présents sur toutes les routes et chemins du monde. Motos ou scooters, pour les motards exigents, les sportifs à la recherche de la perfection et les aventuriers des grands espaces. Schuberth répond présent avec une sélection de casques et d'acccessoires qui permettront de rendre votre équipement unique : téléphonez, naviguez ou communiquez avec votre passager en toute simplicité avec des éléments de communication et géolocalisation qui s'intègreront parfaitement à votre casque. Schuberth, c'est l'amour du détail !"
"88"|"SEGURA"|"1",NULL,NULL,"https://www.dafy-moto.com/images/brand/medium/segura.png"|"Depuis plus de 30 ans, la marque Segura est restée fidèle aux principes et valeurs de ses débuts : esprit racing, style, liberté et vintage. C’est une marque de passion par excellence : passion de la course et passion de la qualité. Elle bénéficie d’un savoir-faire né de la compétition qu'elle transmet dans la confection de vêtements de moto pour hommes et femmes. Ce savoir-faire, ces compétences permettent à Segura de proposer une gamme complète d'accessoires et de vêtements de moto. L'univers Segura se retrouve dans les blousons de moto de la marque, dans la confection de ses gants moto ou encore dans la réalisation des pantalons."
"89"|"EQUIPEMENT MOTO SENA"|"1",NULL,NULL,"https://www.dafy-moto.com/images/brand/medium/sena.png"|"Sena est une marque américaine reconnue, lancée en 1998 aux Etats-Unis, spécialisée dans le développement de systèmes de communication bluetooth dédiés à l’usage du 2-roues. Elle s’est peu à peu développée sur le marché européen depuis 2010 et s’impose désormais comme la marque référente. Elle propose une quinzaine d’intercoms moto disponibles par paire ou en solo, pouvant s’utiliser avec tous types de casques de moto : intégral, jet ou modulable."
"90"|"SHAD"|"1",NULL,NULL,"https://www.dafy-moto.com/images/brand/medium/shad.png"|"Shad est la marque de référence dans la fabrication de bagagerie moto (rigide et souple) et selles pour motos. L’entreprise espagnole dessine, produit et distribue ses produits dans le monde entier. La qualité et l’innovation des produits Shad ont fait leur renommée. La marque propose des top-cases, des valises, leurs systèmes de fixation, de la bagagerie souple et waterproof et des selles motos et quads."
"91"|"SIFAM"|"1",NULL,NULL,"https://www.dafy-moto.com/images/brand/medium/sifam.png"|"Le groupe Sifam distribue depuis 1994 sur le marché européen les plus grandes marques de pièces moto. Réparti sur plusieurs entités, Sifam distribue différents produits et grandes marques sur l'ensemble du globe dans le domaine de la moto. Très présent en France, la marque déploie ses compétence sur le reste du monde pour apporter ses produits et compétences au monde de la moto. Le groupe a également développé sa propre gamme de produits et propose sous la marque Sifam des kits chaînes, des plaquettes de frein, des joints moteur, ou encore des tube de fourche. Des pièces moteurs route et tout-terrain qui prendront la place des pièces d'origine de votre moto pour en améliorer les caractéristiques de base."
"92"|"SKF"|"1",NULL,NULL,"https://www.dafy-moto.com/images/brand/medium/skf_logo.svg-278.jpg",
"93"|"SKYRICH"|"1",NULL,NULL,"https://www.dafy-moto.com/images/brand/medium/skyrich-600x315_f4ds-dz-1-338.jpg",
